{
  "acceptance_results": [
    {
      "checks": [
        "harness-validate",
        "native-typecheck",
        "native-node"
      ],
      "criterion": "REL-001",
      "result": "PASS"
    },
    {
      "checks": [
        "harness-validate",
        "native-typecheck",
        "native-node"
      ],
      "criterion": "REL-002",
      "result": "PASS"
    },
    {
      "checks": [
        "harness-validate",
        "native-typecheck",
        "native-node"
      ],
      "criterion": "REL-003",
      "result": "PASS"
    },
    {
      "checks": [
        "harness-validate",
        "native-typecheck",
        "native-node"
      ],
      "criterion": "REL-004",
      "result": "PASS"
    },
    {
      "checks": [
        "harness-validate",
        "native-typecheck",
        "native-node"
      ],
      "criterion": "REL-005",
      "result": "PASS"
    },
    {
      "checks": [
        "harness-validate",
        "native-typecheck",
        "native-node"
      ],
      "criterion": "REL-006",
      "result": "PASS"
    }
  ],
  "check_config_hash": "bb71123120b5a38c4988ef3583f7ed41171882b57d22a4ae761c2b233b2e15c9",
  "checked_tasks": [
    "REL-001"
  ],
  "created_at": "2026-10-28T20:33:41.022839+00:00",
  "definition_hash": "bb64f5c24609feaf0a5b82264ba5f2f53d68f0dc20f2ac33649640263eac2f92",
  "environment": {
    "declared": {
      "application_runtime": "UNCONFIGURED",
      "note": "Record significant toolchain/container/database versions here before application verification. Do not put credentials here."
    },
    "machine": "arm64",
    "platform": "Darwin",
    "python": "3.14.3"
  },
  "fingerprint": "e31e46034377267fb5514d43514b9eff6ba8a5905967801d4738483e31a8a13c",
  "id": "7dfc724e-1935-45f8-928b-ca3a7024c194",
  "result": "PASS",
  "results": [
    {
      "check": "harness-validate",
      "command": [],
      "exit_code": 0,
      "result": "PASS",
      "summary": "Builtin assertions passed."
    },
    {
      "check": "native-node",
      "command": [
        "node",
        "--test",
        "tests-node/windows.test.mjs",
        "tests-node/engine-upgrade.test.mjs",
        "tests-node/copilot.test.mjs"
      ],
      "exit_code": 0,
      "log": ".harness/evidence/logs/11082743-6bb9-4270-bb4d-cd30ff492d88.log",
      "log_hash": "9259af8a988f878082caae525760a8384542a9bf5a3734eed46b87c9e0098406",
      "result": "PASS",
      "summary": "tes help, errors and gates\nok 20 - Python owns initial state and setup event; installed CLI delegates help, errors and gates\n  ---\n  duration_ms: 2486.889083\n  ...\n# Subtest: installed engine drift, wrong protocol, missing Python and root injection fail closed\nok 21 - installed engine drift, wrong protocol, missing Python and root injection fail closed\n  ---\n  duration_ms: 1137.928125\n  ...\n# Subtest: three-way Git merge covers local-only, remote-only, disjoint, overlap and missing Git\nok 22 - three-way Git merge covers local-only, remote-only, disjoint, overlap and missing Git\n  ---\n  duration_ms: 10.965\n  ...\n# Subtest: migration validates both versions, adds defaults, is ordered and idempotent\nok 23 - migration validates both versions, adds defaults, is ordered and idempotent\n  ---\n  duration_ms: 0.158917\n  ...\n# Subtest: upgrade preserves local Skills, shared rules, OpenSpec and custom files; dry-run and repeat unchanged\nok 24 - upgrade preserves local Skills, shared rules, OpenSpec and custom files; dry-run and repeat unchanged\n  ---\n  duration_ms: 1800.103\n  ...\n# Subtest: 0.3.0 installation manifest can upgrade to the current release\nok 25 - 0.3.0 installation manifest can upgrade to the current release\n  ---\n  duration_ms: 1424.646583\n  ...\n# Subtest: 0.3.1 installation manifest can upgrade to the current release\nok 26 - 0.3.1 installation manifest can upgrade to the current release\n  ---\n  duration_ms: 1406.253542\n  ...\n# Subtest: legacy missing baseline, local deletion, removed ownership and collisions explicitly conflict\nok 27 - legacy missing baseline, local deletion, removed ownership and collisions explicitly conflict\n  ---\n  duration_ms: 1047.709875\n  ...\n# Subtest: interrupted upgrade retains backup, recovery restores bytes and retry works\nok 28 - interrupted upgrade retains backup, recovery restores bytes and retry works\n  ---\n  duration_ms: 1836.519375\n  ...\n# Subtest: postvalidation failure retains journal and protects concurrent edits during recovery\nok 29 - postvalidation failure retains journal and protects concurrent edits during recovery\n  ---\n  duration_ms: 1581.197208\n  ...\n# Subtest: doctor engine cannot import project shadow modules; missing inventory entry is rejected\nok 30 - doctor engine cannot import project shadow modules; missing inventory entry is rejected\n  ---\n  duration_ms: 1241.483292\n  ...\n# Subtest: lifecycle writes refuse installer lock and pending recovery, reads still work\nok 31 - lifecycle writes refuse installer lock and pending recovery, reads still work\n  ---\n  duration_ms: 1699.04325\n  ...\n# Subtest: custom runtime upgrade cannot silently claim upstream engine version\nok 32 - custom runtime upgrade cannot silently claim upstream engine version\n  ---\n  duration_ms: 1026.739666\n  ...\n# Subtest: interruption after configuration write restores pre-upgrade config and manifest\nok 33 - interruption after configuration write restores pre-upgrade config and manifest\n  ---\n  duration_ms: 1580.646292\n  ...\n# Subtest: packaged launchers use portable line endings and include native entry points\nok 34 - packaged launchers use portable line endings and include native entry points\n  ---\n  duration_ms: 0.661625\n  ...\n# Subtest: Windows copied environments preserve mixed-case Path discovery\nok 35 - Windows copied environments preserve mixed-case Path discovery # SKIP\n  ---\n  duration_ms: 0.043875\n  ...\n# Subtest: Windows npm shims preserve argument boundaries without cmd interpolation\nok 36 - Windows npm shims preserve argument boundaries without cmd interpolation # SKIP\n  ---\n  duration_ms: 0.077166\n  ...\n# Subtest: Windows managed Python is discovered from its runtime pointer\nok 37 - Windows managed Python is discovered from its runtime pointer # SKIP\n  ---\n  duration_ms: 0.0775\n  ...\n# Subtest: portable argument and file operations in spaces and Unicode directories\nok 38 - portable argument and file operations in spaces and Unicode directories\n  ---\n  duration_ms: 95.339625\n  ...\n1..38\n# tests 38\n# suites 0\n# pass 33\n# fail 0\n# cancelled 0\n# skipped 5\n# todo 0\n# duration_ms 18358.329875\n"
    },
    {
      "check": "native-typecheck",
      "command": [
        "node",
        "node_modules/typescript/bin/tsc",
        "--noEmit"
      ],
      "exit_code": 0,
      "log": ".harness/evidence/logs/e43f8cc2-a92f-482d-9aa4-c72775a13283.log",
      "log_hash": "12ae32cb1ec02d01eda3581b127c1fee3b0dc53572ed6baf239721a03d82e126",
      "result": "PASS",
      "summary": ""
    }
  ],
  "revisions": {
    "architecture": "0",
    "tech_spec": "0"
  },
  "schema_version": 1,
  "task_id": "REL-001"
}
