{
  "acceptance_results": [
    {
      "checks": [
        "harness-tests"
      ],
      "criterion": "TST-001",
      "result": "PASS"
    },
    {
      "checks": [
        "harness-tests"
      ],
      "criterion": "TST-002",
      "result": "PASS"
    },
    {
      "checks": [
        "harness-tests"
      ],
      "criterion": "TST-003",
      "result": "PASS"
    },
    {
      "checks": [
        "harness-tests"
      ],
      "criterion": "TST-004",
      "result": "PASS"
    },
    {
      "checks": [
        "harness-validate",
        "harness-tests"
      ],
      "criterion": "TST-005",
      "result": "PASS"
    },
    {
      "checks": [
        "harness-validate",
        "harness-tests"
      ],
      "criterion": "TST-006",
      "result": "PASS"
    }
  ],
  "check_config_hash": "bb71123120b5a38c4988ef3583f7ed41171882b57d22a4ae761c2b233b2e15c9",
  "checked_tasks": [
    "TST-001"
  ],
  "created_at": "2026-10-27T21:20:21.153713+00:00",
  "definition_hash": "013e37debaf740801afc462915d76f277fa647e788bc194b29d0ca9231abebc5",
  "environment": {
    "declared": {
      "application_runtime": "UNCONFIGURED",
      "note": "Record significant toolchain/container/database versions here before application verification. Do not put credentials here."
    },
    "machine": "arm64",
    "platform": "Darwin",
    "python": "3.14.3"
  },
  "fingerprint": "696c7b562cf2b0341db93c3977c5f779ff71a78a8bafb22dee7b352919581b73",
  "id": "d3f5521d-9379-415b-888d-993b15f7f2f8",
  "result": "PASS",
  "results": [
    {
      "check": "harness-tests",
      "command": [
        "{python}",
        "-B",
        "harness",
        "self-test"
      ],
      "exit_code": 0,
      "log": ".harness/evidence/logs/aba1b06d-674a-4b2a-9306-24dbe1f6fd69.log",
      "log_hash": "c242d17b9f6ffd154e5e66f2171b0aeb2146172c780c43cb5257d0392b35bd53",
      "result": "PASS",
      "summary": "_tests_review_and_final_approval) ... ok\ntest_final_consent_requires_prior_review (test_workflow.WorkflowTests.test_final_consent_requires_prior_review) ... ok\ntest_floor_and_stricter_or_simpler_selection (test_workflow.WorkflowTests.test_floor_and_stricter_or_simpler_selection) ... ok\ntest_guards_allow_negatives_but_block_new_ambiguity_and_sensitive_code (test_workflow.WorkflowTests.test_guards_allow_negatives_but_block_new_ambiguity_and_sensitive_code) ... ok\ntest_identical_assessment_preserves_confirmation (test_workflow.WorkflowTests.test_identical_assessment_preserves_confirmation) ... ok\ntest_known_metadata_and_previous_advisor_conclusions_do_not_reinforce_risk (test_workflow.WorkflowTests.test_known_metadata_and_previous_advisor_conclusions_do_not_reinforce_risk) ... ok\ntest_material_changes_invalidate_but_implementation_does_not (test_workflow.WorkflowTests.test_material_changes_invalidate_but_implementation_does_not) ... ok\ntest_missing_inspection_blocks_low_risk_confirmation (test_workflow.WorkflowTests.test_missing_inspection_blocks_low_risk_confirmation) ... ok\ntest_negative_text_never_overrides_structured_or_project_strict_floors (test_workflow.WorkflowTests.test_negative_text_never_overrides_structured_or_project_strict_floors) ... ok\ntest_new_template_requires_assessment_before_start (test_workflow.WorkflowTests.test_new_template_requires_assessment_before_start) ... ok\ntest_oversize_guard_evidence_requires_investigation_instead_of_skipping (test_workflow.WorkflowTests.test_oversize_guard_evidence_requires_investigation_instead_of_skipping) ... ok\ntest_policy_change_invalidates_and_project_checks_cannot_be_omitted (test_workflow.WorkflowTests.test_policy_change_invalidates_and_project_checks_cannot_be_omitted) ... ok\ntest_profile_recommendations_and_bounded_assessment (test_workflow.WorkflowTests.test_profile_recommendations_and_bounded_assessment) ... ok\ntest_public_exposure_and_medium_risk_are_distinct_from_security_floor (test_workflow.WorkflowTests.test_public_exposure_and_medium_risk_are_distinct_from_security_floor) ... ok\ntest_reference_edit_invalidates_combined_consent (test_workflow.WorkflowTests.test_reference_edit_invalidates_combined_consent) ... ok\ntest_report_distinguishes_optional_approvals_and_legacy_plan (test_workflow.WorkflowTests.test_report_distinguishes_optional_approvals_and_legacy_plan) ... ok\ntest_reports_real_files_paths_and_missing_evidence (test_workflow.WorkflowTests.test_reports_real_files_paths_and_missing_evidence) ... ok\ntest_sensitive_task_metadata_cannot_claim_fast (test_workflow.WorkflowTests.test_sensitive_task_metadata_cannot_claim_fast) ... ok\ntest_sensitive_task_outcome_uses_same_narrative_classifier (test_workflow.WorkflowTests.test_sensitive_task_outcome_uses_same_narrative_classifier) ... ok\ntest_source_identifiers_override_negative_comments_and_match_boundaries (test_workflow.WorkflowTests.test_source_identifiers_override_negative_comments_and_match_boundaries) ... ok\ntest_strict_deeper_review_resolves_exact_ambiguous_sources (test_workflow.WorkflowTests.test_strict_deeper_review_resolves_exact_ambiguous_sources) ... ok\ntest_task_metadata_review_survives_its_own_workflow_write (test_workflow.WorkflowTests.test_task_metadata_review_survives_its_own_workflow_write) ... ok\ntest_unknowns_require_targeted_inspection_not_automatic_strict (test_workflow.WorkflowTests.test_unknowns_require_targeted_inspection_not_automatic_strict) ... ok\n\n----------------------------------------------------------------------\nRan 282 tests in 57.799s\n\nOK (skipped=8)\nSlowest self-tests (seconds):\n  2.4164  test_native_windows.NativePlatformTests.test_bounded_tool_run_cleans_up_descendants_on_timeout\n  1.4470  test_hardening.HardeningTests.test_dependency_chain_survives_downstream_edits_and_rechecks_prerequisite\n  1.2945  test_hardening.HardeningTests.test_runner_repairs_review_feedback_without_fabricating_approval\n  1.2740  test_hardening.HardeningTests.test_changed_dependency_definition_invalidates_completion\n  1.2608  test_openspec.OpenSpecTests.test_real_execution_and_review_completion\n"
    },
    {
      "check": "harness-validate",
      "command": [],
      "exit_code": 0,
      "result": "PASS",
      "summary": "Builtin assertions passed."
    }
  ],
  "revisions": {
    "architecture": "0",
    "tech_spec": "0"
  },
  "schema_version": 1,
  "task_id": "TST-001"
}
